Organisation,Titel,Datum,Location,Description,Link
Munich Startup,Online: Holdingstrukturen: Umsetzung und Vorteile für Startups,25. September,,"gate-Academy: Workshop in Zusammenarbeit mit KPMG
Du fragst dich, welche Vorteile eine Holdingstruktur für dein Startup haben kann und wie du sie umsetzt? Dann bist du bei unserer nächsten gate-Academy genau richtig.
Im online Themenvortrag mit anschließendem Q&A erläutert dir Christina Rester von KPMG, folgende Inhalte:
In welcher Konstellation macht eine Holdingstruktur für dein Startup Sinn?
Welche steuerlichen Vorteile bringt sie?
Welche rechtlichen Rahmenbedingungen zur Umsetzung sind nötig?
Hier findet Ihr mehr Informationen zu der Veranstaltung.",https://www.munich-startup.de/veranstaltung/online-holdingstrukturen-umsetzung-und-vorteile-fuer-startups-2/
Munich Startup,Online: STRENGTHEN – Be Resilient to Transform!,14. Oktober,,"Women Start-up Empowerment Training Series
Welcome to the online Training „STRENGTHEN – Be Resilient to Transform!“.
Resilience is key to bringing responsible entrepreneurship and regenerative business ideas to life. In this session we will explore the essential inner skills and qualities of change makers, consciously building on the inner development goals. Starting with ourselves from an individual perspective, we will then branch out to look at teams and structures working towards a systemic understanding of resilience.
Learning Outcomes:
Introduction to the Inner Development Goals as a framework anchored to the Sustainable Development Goals
Systemic understanding of resilience beyond narrow, short-term notions of “self-care”
Self-reflection and inspiration to strengthen the resilience of projects, teams and structures
Requirements:
First project experiences
Self-awareness and curiosity
Hier findet Ihr mehr Informationen zu der Veranstaltung.",https://www.munich-startup.de/veranstaltung/online-strengthen-be-resilient-to-transform/
Munich Startup,Online: VCs verstehen – Wie tickt ein VC und wie wähle ich den richtigen aus,16. Oktober,,"gate-Academy: Workshop in Zusammenarbeit mit KPMG (online)
Im Themenvortrag mit anschließendem Q&A erläutert Michael Königer von KPMG:
Interessen und Sichtweisen von VCs
wie zielführende Kommunikation aussieht
und wie du Fehlentscheidungen vorbeugen kannst
Hier findet Ihr mehr Informationen zu der Veranstaltung.",https://www.munich-startup.de/veranstaltung/online-vcs-verstehen-wie-tickt-ein-vc-und-wie-waehle-ich-den-richtigen-aus-4/
Munich Startup,Startup WORK Job Messe,24. Oktober,"Am Kartoffelgarten 14, 81671 München","Nach einer sehr erfolgreichen Startup WORK Ausgabe im Oktober 2024 mit mehr als 350 Jobsuchenden und +15 Startups, geben wir den Startschuss für die Startup WORK 2025!
Also seid am 24. Oktober 2025 entweder mit Eurem Startup oder als Jobsuchende/r dabei!
STARTUP WORK FÜR STARTUPS
Zugang zu 300+ Talenten
Vorab-Zugang zu Lebensläufen & Matching mit passenden Jobsuchenden
Bewerber direkt kennenlernen und vor Ort interviewen
Networking mit anderen Startups aus dem Ökosystem
Workshops, Keynotes und Interviews
STARTUP WORK FÜR JOBSUCHENDE
Ganztägiger Zugang zur Messe mit 15+ Startups
Kostenlose Bewerbungsfotos mit Premiumticket
Lade Deinen Lebenslauf zum Pre-Matching mit den Startup-Ausstellern hoch
Lerne die HR Personen in einer entspannten Atmosphäre direkt vor Ort kennen
Vorstellungsgespräche vor Ort
Workshops & Keynotes
Hier findet Ihr mehr Informationen zu der Veranstaltung.",https://www.munich-startup.de/veranstaltung/startup-work-job-messe-2025/
Munich Startup,AFTERWERK – Startup Pitches & Networking,30. Oktober,"Am Kartoffelgarten 14, 81671 München","Alle zwei Monate findet im WERK1 das AFTERWERK statt. Hier stellen sich alle neu im Inkubator eingezogenen Startups mit einem kurzen Pitch vor. Neben den Pitches teilt das WERK1 alle News rund um das Gründerzentrum und es ist die perfekte Gelegenheit, mit Personen aus dem Münchner Startup-Ökosystem zu networken. Schaut gerne vorbei!
Hier findet Ihr mehr Informationen zu der Veranstaltung.",https://www.munich-startup.de/veranstaltung/afterwerk-startup-pitches-networking-1025/
Munich Startup,.,2. Dezember,,,https://www.munich-startup.de/veranstaltung/105484/
